Category,asin,Rank,Product Name,Rating,Rating Count,Price,tag
Semi-Automatic Espresso Machines,B0B12TQK3J,1.0,"INALSA Espresso/Cappuccino 4Cup Coffee Maker 800W- Bonjour (3in1- Espresso,Cappuccino & Latte)|Frothing Function,4Bar Pressure|Multipurpose Control Knob,Removable Drip Tray & Borosilicate Glass Carafe",3.9,450.0,3995.0,4-Cup Coffee Maker
Espresso Machines,B0B12TQK3J,2.0,"INALSA Espresso/Cappuccino 4Cup Coffee Maker 800W- Bonjour (3in1- Espresso,Cappuccino & Latte)|Frothing Function,4Bar Pressure|Multipurpose Control Knob,Removable Drip Tray & Borosilicate Glass Carafe",3.9,450.0,3995.0,4-Cup Coffee Maker
Home & Kitchen,B08X2R1HM5,4.0,"JIALTO Adhesive Hooks Heavy Duty Wall Hooks, Nail Hook for Hanging Coat, Hat,Towel Robe Hook Rack Wall Mount- Bathroom and Bedroom Hooks for Wall Without Drilling (Nail Hook Trasparent 10 Pack)",4.0,11588.0,199.0,Adhesive Wall Hooks
Home & Kitchen,B0CCM8L54V,14.0,"Zulaxy Photo Frame Hooks for Wall Without Drilling, 10 Pack Self Adhesive Hooks for Wall Heavy Duty Strong Nail Free for Hanging Photo Frame (Hanging Hook, Transparent) Stainless Steel",3.6,3731.0,274.0,Adhesive Wall Hooks for Hanging Photo Frames
Home & Kitchen,B07L6GZYDV,11.0,"Wakefit Microfiber Height Adjustable Hollow Fibre Sleeping Pillow With Zip | Set of 2 (White And Grey,  27 X 16 Inches)",4.3,68157.0,749.0,Adjustable Microfiber Sleeping Pillow
Espresso Machines,B0BR7BXL5X,5.0,"AGARO Supreme Espresso Coffee Maker With Grinder, 20 Bars Semi Automatic, Dual Heating System, Steam Wand And Adjustable Milk Frothing, All in One Espresso, Cappuccino, Steam Espresso Maker",3.5,112.0,32990.0,All-in-One Espresso Maker
Paella Pans,B07JBWKFSY,1.0,"Wonderchef Aluminium Appachetty with Lid, 20cm, Crimson",3.9,176.0,1229.0,Aluminium Appachetty with Lid
Woks,B0BTWR1QN3,29.0,Tannu Craft Aluminium kadhai Premium Range of Aluminum Kadhai Deep Kadai | Non Induction Kadai | Non Stick Kadai | Deep Cooking (2 Litter),3.6,124.0,399.0,Aluminium Deep Cooking Kadhai
Pots & Pans,B00NRT7ZUO,22.0,Hawkins Contura 3L Aluminium Inner Lid Pressure Cooker (Silver),4.2,19737.0,1508.0,Aluminium Inner Lid Pressure Cooker
Cookware,B00NRT7ZUO,22.0,Hawkins Contura 3L Aluminium Inner Lid Pressure Cooker (Silver),4.2,19737.0,1508.0,Aluminium Inner Lid Pressure Cooker
Pots & Pans,B00SX2YZNK,29.0,"Hawkins Classic 1.5L Aluminium Inner Lid Pressure Cooker, Silver",4.2,19038.0,1078.0,Aluminium Inner Lid Pressure Cooker
Cookware,B00SX2YZNK,30.0,"Hawkins Classic 1.5L Aluminium Inner Lid Pressure Cooker, Silver",4.2,19038.0,1078.0,Aluminium Inner Lid Pressure Cooker
Kadhai & Woks,B015SQQ1CG,19.0,"HAZEL 4 mm Aluminium Kadai with Handle, 750 ml, Silver.",4.0,1095.0,609.0,Aluminium Kadai with Handle
Stir-Fry Pans,B015SQQ1CG,23.0,"HAZEL 4 mm Aluminium Kadai with Handle, 750 ml, Silver.",4.0,1095.0,609.0,Aluminium Kadai with Handle
Woks,B097YMM5GG,18.0,Redific Aluminium Kadhai Kadai with Handle for Kitchen | Deep Frying Kadai (Size:2.5 litres and 4 litres) (Material: Aluminium Kadhai)(Item: Kadhai/Kadai)(Color: Silver) Combo Pack of 2,3.6,154.0,799.0,Aluminium Kitchen Kadhai Combo Pack
Pots & Pans,B00TE7QY7S,23.0,Pigeon By Stovekraft Favourite Aluminium Pressure Cooker with Outer Lid Induction and Gas Stove Compatible 5 Litre Capacity for Healthy Cooking (Silver),4.0,17411.0,1039.0,Aluminium Pressure Cooker
Cookware,B00TE7QY7S,23.0,Pigeon By Stovekraft Favourite Aluminium Pressure Cooker with Outer Lid Induction and Gas Stove Compatible 5 Litre Capacity for Healthy Cooking (Silver),4.0,17411.0,1039.0,Aluminium Pressure Cooker
Pots & Pans,B00EVR7NA8,30.0,"Hawkins 1.5 Litre Miss Mary Aluminium Pressure Cooker, Small Inner Lid Cooker, Silver (MM15)",4.2,12438.0,900.0,Aluminium Pressure Cooker
Pots & Pans,B00VK5MCMI,8.0,Pigeon By Stovekraft Favourite Aluminium Pressure Cooker with Outer Lid Gas Stove Compatible 3 Litre Capacity for Healthy Cooking (Silver),3.8,26375.0,719.0,Aluminium Pressure Cooker with Outer Lid
Cookware,B00VK5MCMI,8.0,Pigeon By Stovekraft Favourite Aluminium Pressure Cooker with Outer Lid Gas Stove Compatible 3 Litre Capacity for Healthy Cooking (Silver),3.8,26375.0,719.0,Aluminium Pressure Cooker with Outer Lid
Stovetop Espresso Pots,B09B4VVWKT,26.0,Niyam 3-Cup 150 ml Aluminum Coffee Maker Espresso Machine Percolator Gas Base Moka Pot (8 x 8 x 15.5 cm) (Black),3.7,173.0,649.0,Aluminum Coffee Maker
Woks,B0C9PW3W1X,28.0,"KENT Hard Anodised Kadhai 2L, 22 CM | Non Reactive, Non Toxic, & Non staining Food Grade Surface | 4.06 mm Thick Base for Uniform Heating | Cool Touch bakelite Handle | Induction Friendly, Black",4.2,122.0,1049.0,Anodised Kadhai
Home & Kitchen,B0C73B4D1W,19.0,"DesiDiya® Astronaut Galaxy Projector with Remote Control - 360° Adjustable Timer Kids Astronaut Nebula Night Light, for Gifts,Baby Adults Bedroom, Gaming Room, Home and Party (Corded Electric)",4.0,25546.0,1469.0,Astronaut Galaxy Projector
Hot Tea Machines,B0926VKW1X,1.0,"Cafe DESIRE I DRINK SUCCESS Tea Coffee Machine - 2Lane | Advanced Robust Fully Automatic Coffee Vending Machine | For Offices, Shops and Smart Homes | Make 2 Varieties of Coffee Tea with Premix",4.5,296.0,15900.0,Automatic Coffee Tea Machine
Home & Kitchen,B07FPKJ7MP,24.0,Godrej aer Matic Kit (Machine + 1 Refill) - Automatic Room Fresheners with Flexi Control Spray | Violet Valley Bloom | 2200 Sprays Guaranteed | Lasts up to 60 days (225ml),4.2,24628.0,527.0,Automatic Room Freshener Kit
Home & Kitchen,B07FPRB9CR,28.0,Godrej aer Matic Refill - Automatic Room Fresheners | Violet Valley Bloom | 2200 Sprays Guaranteed | Lasts up to 60 days (225ml),4.3,14194.0,276.0,Automatic Room Freshener Refill
Hot Water Boilers & Dispensers,B07P5RT9PC,3.0,LEMONDA Upgraded Bottle Water Pump USB Charging Automatic Drinking Water Pump Electric Water Dispenser Portable for Home Office Outdoor Use,2.7,1463.0,429.0,Automatic Water Dispenser
Hot Water Boilers & Dispensers,B0BXF9L7SV,1.0,"WAZDORF Universal Automatic Water Dispenser Pump, Portable Automatic Drinking Water Bottle Pump for Universal with USB Electric Charging and Automatic Off Switch for Home, Office",4.0,898.0,699.0,Automatic Water Dispenser Pump
Super-Automatic Espresso Machines,B004WZ6CRO,2.0,"Melitta SOLO & Milk E953-102, Bean to Cup Automatic Coffee Machine, with Milk Steamer and Inbuilt Grinder, Silver",4.2,685.0,49900.0,Bean to Cup Coffee Machine with Milk Steamer
Reusable Filters,B093C99H3C,20.0,"NEOUZA Coffee 51mm Bottomless Portafilter Compatible with DeLonghi Dedica EC680/EC685/EC785/EC820/EC850/EC860 SMEG Coffee Machine, Stainless Steel,Rosewood.Free with Basket, Spoon, tamper mat",4.2,119.0,6170.0,Bottomless Portafilter with Accessories
Espresso Machines,B07XJ6YKQB,6.0,"Coffeeza Finero Next Capsule Coffee Machine (Black) - 20 Bar pressure, Nespresso Capsule Compatible | Perfect Coffee Maker for Espresso & Cappuccino - (FREE 10 assorted capsules Included)",4.4,281.0,11499.0,Capsule Coffee Machine
Espresso Machines,B0929C5G91,24.0,"COFFEEZA Finero Next Capsule Coffee Machine (Black) & Milk Frother - 20 Bar pressure, Nespresso Capsule Compatible | Perfect Coffee Maker for Espresso & Cappuccino - (FREE 10 assorted capsules)",4.4,142.0,16498.0,Capsule Coffee Machine with Milk Frother
Coffee Capsule Holders,B09FMVDZ1W,17.0,Premium Storage Drawer for Bartesian Capsules by Ksestor - Holds up to 40 Bartesian Pods - BEV Black Decker Cocktail Maker Compatible - Sturdy and Stackable Bartesian Pod Holder - Bartesian,4.7,819.0,11451.0,Capsule Storage Drawer
Capsule Stands,B07BQK5SZM,20.0,Capsules Holder Carousel 360 Degree Revolving Stores 80 Pods Rackï¼Å’ Cast Iron Black Color 5 Size 8 Boxes,4.5,602.0,5989.22,Capsules Holder Carousel
Capsule Stands,B07BQGZ82J,27.0,Flagship Capsules Holder Carousel Revolving Stores 60 Pods Rack Cast Iron Black Color 5 Size 6 Boxes,4.6,321.0,5176.0,Capsules Holder Carousel
Woks,B0B9LNPPPB,23.0,"GEMMA Cast Iron Kadai | Black | 3 LTR | 2.6kg This Iron kadhai it is Perfect Iron kadai for Cooking in Induction, Gas | cast Iron cookware is Naturally Non Stick",3.9,211.0,1249.0,Cast Iron Kadai
Frying Pans,B073Q8RYQM,12.0,"amazon basics Pre-Seasoned Cast Iron Skillet Pan - L (10.25 inch, 2.18 Kgs) - Black",4.2,4131.0,1083.0,Cast Iron Skillet Pan
Manual Grinders,B001804CLY,12.0,"Hario Ceramic Coffee Mill ""Mini-Slim""",4.3,11842.0,2849.0,Ceramic Coffee Mill
Manual Grinders,B01LXZACFB,26.0,"HARIO Ceramic Coffee Mill - ""Skerton Plus"", Glass (MSCS-2DTB)",4.4,2393.0,3285.0,Ceramic Coffee Mill
Coffee Grinders,B001804CLY,28.0,"Hario Ceramic Coffee Mill ""Mini-Slim""",4.3,11842.0,2849.0,Ceramic Coffee Mill
Stovetop Espresso Pots,B08SWGFR86,10.0,"IBELL MP6450S Classic 6 Cup Moka Pot Espresso Maker/Percolator/filter Coffee Maker, Italian Espresso - Grey",4.2,121.0,973.0,Classic Coffee Maker
Stovetop Espresso Pots,B09BM63WZ7,13.0,"Cafe JEI Classic Stovetop Espresso Maker for Great Flavored Strong Espresso, 6 Espresso Cup Classic Italian Style Espresso Moka Pot, Makes Delicious Coffee, Easy to Operate & Clean (240ml, Silver)",4.3,212.0,2499.0,Classic Stovetop Espresso Maker
Capsule Stands,B07NQSVQ89,13.0,"Mixpresso Capsule Spinning Carousel Holder I 360 Degree Rotatable Coffee Capsules Holder Rack I Solid Base | Holds 40 Coffee Pods Easy Access, Espresso Pod Holder For Home & Office",4.0,627.0,1199.0,Coffee Capsule Holder
Coffee Capsule Holders,B07NQSVQ89,22.0,"Mixpresso Capsule Spinning Carousel Holder I 360 Degree Rotatable Coffee Capsules Holder Rack I Solid Base | Holds 40 Coffee Pods Easy Access, Espresso Pod Holder For Home & Office",4.0,627.0,1199.0,Coffee Capsule Holder
Capsule Drawers,B07KLTZFHD,23.0,Attom Tech Home Stylish Coffee Capsule Storage Drawer Holder Compatible for Nespresso Storage Steel Organizer Nespresso Holder for Capsules - 40 Capsule Capacity,4.6,331.0,6650.0,Coffee Capsule Storage Drawer
Drip Coffee Machines,B00PVT30YI,8.0,"Kitchen Mart Stainless Steel South Indian Filter Coffee Drip Maker, Madras Kappi, Drip Decotion Maker 200ml Medium size (2-4 Cup)",4.1,4913.0,290.0,Coffee Drip Maker
Reusable Filters,B0040VIN18,13.0,HARIO Paperless Coffee Dripper Black Stainless Steel Filter CFOD-02,4.2,2453.0,1449.0,Coffee Dripper Filter
Drip Coffee Machines,B093G2VRY9,23.0,"BURRDOFF Coffee Filter for Home (450ml), Filter Coffee Maker Steel Coffee Filter for Home Stainless Steel Coffee Filter Steel Indian Coffee Filter South Indian",4.2,743.0,649.0,Coffee Filter
Coffee Filters,B0007VJMM4,15.0,Melitta Two Cup Coffee Filter Paper: Pack of 80,4.4,1291.0,575.0,Coffee Filter Paper
Disposable Coffee Filters,B0007VJMM4,11.0,Melitta Two Cup Coffee Filter Paper: Pack of 80,4.4,1291.0,575.0,Coffee Filter Paper: Pack of 80
Disposable Coffee Filters,B000WVZMW8,20.0,"Melitta Coffee Filter Papers, Size 1x4, Pack of 80",4.7,9091.0,590.0,Coffee Filter Papers
Coffee Filters,B000WVZMW8,29.0,"Melitta Coffee Filter Papers, Size 1x4, Pack of 80",4.7,9091.0,590.0,Coffee Filter Papers
Disposable Coffee Filters,B00EXT6RI8,22.0,Hario Paper Coffee Filter Misarashi for 02 Dripper: 2-Pack,4.8,372.0,1423.0,Coffee Filter for Dripper
Reusable Filters,B08TW6TW57,8.0,"Stainless Steel Coffee Filter, 51mm Double Layer Pressurized Filter Basket Espresso Filter Basket for Portafilter Coffee Machine(Double Cup)",4.3,380.0,2581.0,Coffee Filter for Espresso Machine
Disposable Coffee Filters,B001O0R46I,2.0,"Hario V60 Paper Coffee Filters, Size 02, Natural, Tabbed",4.6,18269.0,712.0,Coffee Filters
Disposable Coffee Filters,B0029PVRXS,16.0,"HARIO Coffee Paper Filters (Size 02, 100 Sheets, Natural) (V60 Filters)",4.5,3791.0,,Coffee Filters
Disposable Coffee Filters,B00G1IBP9U,18.0,"Technivorm #4 Coffee Filters 85022, Box of 100",4.8,6089.0,1728.0,Coffee Filters
Disposable Coffee Filters,B004H78YAU,19.0,"BUNN Coffee Filters, 10/12-Cup Size, 100 Filters/Pack",4.7,2370.0,1550.0,Coffee Filters
Coffee Filters,B00G1IBP9U,24.0,"Technivorm #4 Coffee Filters 85022, Box of 100",4.8,6089.0,1728.0,Coffee Filters
Coffee Filters,B004H78YAU,26.0,"BUNN Coffee Filters, 10/12-Cup Size, 100 Filters/Pack",4.7,2370.0,1550.0,Coffee Filters
Manual Grinders,B0BR7CVF2R,2.0,"AGARO Supreme Coffee Grinder, Conical Burr Grinder, 31 Grinding Settings, Pulse Mode, Adjustable Digital Timer, Single Dose Grinder for Espresso Filter Dripper Moca, Espresso, Silver",4.4,327.0,5930.0,Coffee Grinder
Coffee Grinders,B0BR7CVF2R,7.0,"AGARO Supreme Coffee Grinder, Conical Burr Grinder, 31 Grinding Settings, Pulse Mode, Adjustable Digital Timer, Single Dose Grinder for Espresso Filter Dripper Moca, Espresso, Silver",4.4,327.0,5930.0,Coffee Grinder
Espresso Machines,B01IHRLMAE,10.0,"Nespresso Citiz and Milk Coffee Machine, Black by Magimix",4.7,1570.0,31999.0,Coffee Machine
Drip Coffee Machines,B07WJ4NG21,4.0,"Pigeon Brewster Coffee Maker, 600 Watt, 4 Cups Drip Coffee maker (Black)",3.6,3913.0,1099.0,Coffee Maker
Drip Coffee Machines,B0BFFCF1JP,19.0,Wonderchef Regalia Pronto Coffee Maker 600W |Coffee Brewer Machine for Home & Office|750ml Borosilicate Glass Carafe||6 Cups Coffee| Black & Silver|Keep Hot Plate |2 Year Warranty,3.8,866.0,2199.0,Coffee Maker
Drip Coffee Machines,B008P7IF02,18.0,Morphy Richards New Europa Coffee Making Machine|800W Espresso & Cappuccino Coffee Machine For Home|4-Cups Capacity*|Milk Frothing Nozzle|Removable Drip Tray|2-Yr Warranty By Brand|Black,3.8,4235.0,4499.0,Coffee Making Machine
Measuring Spoons,B019R4JNBQ,23.0,"Chef Craft 4 Piece Perfect Coffee Measuring Spoon Scoop, Black",4.7,5613.0,1134.0,Coffee Measuring Spoon Set
Capsule Baskets,B09K71T2VV,10.0,"Coffee Station Organizer, Wooden Coffee Bar Accessories Organizer for Counter, Farmhouse Kcup Coffee Pod Holder Storage Basket with Handle, Coffee Bar Organizer Station for Coffee Bar Decor White",4.6,305.0,,Coffee Organizer
Capsule Baskets,B09K71575Y,3.0,"Coffee Station Organizer, Wooden Coffee Bar Accessories, Farmhouse Coffee Pod Holder Storage Basket, Countertop Coffee Organizer Station for K Cup Holder",4.6,218.0,4525.0,Coffee Organizer Basket
Coffee Capsule Holders,B09K71575Y,25.0,"Coffee Station Organizer, Wooden Coffee Bar Accessories, Farmhouse Coffee Pod Holder Storage Basket, Countertop Coffee Organizer Station for K Cup Holder",4.6,218.0,4525.0,Coffee Organizer Station
Coffee Filters,B08YFLQ3NK,1.0,"TGL Co. The Good Life Company Hario V60 Coffee Paper Filter (Size 02, 100 Count, White)",4.5,499.0,413.0,Coffee Paper Filter
Disposable Coffee Filters,B08YFLQ3NK,1.0,"TGL Co. The Good Life Company Hario V60 Coffee Paper Filter (Size 02, 100 Count, White)",4.5,499.0,413.0,Coffee Paper Filter
Coffee Maker Accessories,B08YFLQ3NK,2.0,"TGL Co. The Good Life Company Hario V60 Coffee Paper Filter (Size 02, 100 Count, White)",4.5,499.0,413.0,Coffee Paper Filter
Disposable Coffee Filters,B001U7CVEA,7.0,"Hario V60 Misarashi Coffee Paper Filter (Size 01, 100 Count, White)",4.5,6110.0,351.0,Coffee Paper Filter
Coffee Filters,B001U7CVEA,7.0,"Hario V60 Misarashi Coffee Paper Filter (Size 01, 100 Count, White)",4.5,6110.0,410.0,Coffee Paper Filter
"Coffee, Tea & Espresso",B08YFLQ3NK,21.0,"TGL Co. The Good Life Company Hario V60 Coffee Paper Filter (Size 02, 100 Count, White)",4.5,499.0,413.0,Coffee Paper Filter
Disposable Coffee Filters,B073RWF7NT,26.0,"Hario V60 Misarashi Coffee Paper Filter (Size 02, 200-count, Natural)",4.8,4248.0,1494.0,Coffee Paper Filter
Coffee Maker Accessories,B001U7CVEA,27.0,"Hario V60 Misarashi Coffee Paper Filter (Size 01, 100 Count, White)",4.5,6110.0,410.0,Coffee Paper Filter
Coffee Filters,B0029PVRXS,22.0,"HARIO Coffee Paper Filters (Size 02, 100 Sheets, Natural) (V60 Filters)",4.5,3791.0,,Coffee Paper Filters
Capsule Baskets,B09ZQBJQQJ,6.0,"Coffee Pod Holder, Organizer for K Cup, Storage for Coffee Station Counter, Compatible with Nespresso Capsule& Keurig Pods, Coffee Bar Accessories, Acrylic 4 Compartment with Lid - Clear",4.7,125.0,7717.0,Coffee Pod Holder
Capsule Drawers,B088FG76B9,21.0,Coffee Pod Holder Storage Rack Capsules Capacity Drawer for Nespresso Vertuoline (Bottomless with handle-40 pods),4.7,363.0,9724.76,Coffee Pod Holder
Capsule Stands,B07SBQN3D5,16.0,Large-Capacity 12-Sided Polygon Elegant Coffee Pods Holder for Nespresso Vertuoline Capsule,4.5,2681.0,3096.54,Coffee Pods Holder
Disposable Coffee Filters,B09MS5JD7Q,5.0,KaldiPress Coffee Press Percolator with Metal and 500 Paper Filters (Black),4.6,249.0,1499.0,Coffee Press Percolator with Filters
Coffee Filters,B09MS5JD7Q,5.0,KaldiPress Coffee Press Percolator with Metal and 500 Paper Filters (Black),4.6,249.0,1499.0,Coffee Press Percolator with Filters
Coffee Maker Accessories,B09MS5JD7Q,25.0,KaldiPress Coffee Press Percolator with Metal and 500 Paper Filters (Black),4.6,249.0,1499.0,Coffee Press Percolator with Filters
Capsule Baskets,B09FJGSG1H,7.0,"Wooden Coffee Station Organizer, Coffee Bar Accessories Organizer for Counter, Coffee Bar Bin Box, Coffee Pods Holder Storage Basket, Farmhouse Kitchen Coffee Bar Decor, Coffee Lovers Gift",4.7,146.0,6540.64,Coffee Station Organizer
Capsule Baskets,B09JSBR87B,8.0,"Coffee Station Organizer for Counter,Wood Coffee Pods Holder Storage Basket Coffee Bar Accessories Organizer,Coffee Holder for Coffee Bar Decor, Coffee Lover (Black)",4.7,302.0,6293.0,Coffee Station Organizer
Stovetop Espresso Pots,B0047BIWSK,8.0,Aeropress Coffee and Espresso Maker,4.7,19017.0,4120.0,Coffee and Espresso Maker
"Coffee, Tea & Espresso",B0C1GFM99Y,17.0,"AGARO Elite French Press Coffee And Tea Maker, Borosilicate Glass Body With Sleeves, Glass Carafe, BPA Free Plastic Lid Strainer, 600Ml",4.2,306.0,559.0,Coffee and Tea Maker
"Coffee, Tea & Espresso",B07M5GT99K,25.0,Wonderchef French Press Coffee & Tea Maker 350 ml|Borosilicate Glass Carafe|4 Level Filtration System|Stainless Steel Plunger with Mesh|1-2 Cups of Coffee|Brews in Just 3 Minutes|Black|1 Year Warranty,4.1,970.0,599.0,Coffee and Tea Maker
Capsule Drawers,B09Z6JWVZG,13.0,Rice rat Coffee Vertuo Capsule Holder Drawer for Nespresso With Glass For Cabinet Vertuoline Pod Storage Rack For Counter (Class-50 Pods（With handle）),4.4,130.0,11533.0,Coffee capsule holder drawer
Capsule Drawers,B07Z3YSJF7,24.0,"EVERIE Crystal Tempered Glass Top Storage Organizer Drawer for Nespresso Capsules, Holds 40 Big or 52 Small Vertuoline Pods",4.8,8629.0,11770.29,Coffee capsule storage drawer
Capsule Drawers,B07PKSL6F5,14.0,HiveNets Vertuoline HiveNets Coffee Machine Capsule Metal Storage Holder Stand Drawer Dispenser Compatible for Nespresso Vertuo/Vertuoplus 40 PCS Capacity Multiple Flavors Pods Organizer [Black],4.6,1006.0,10308.0,Coffee capsule storage holder
Coffee Filters,B001O0R46I,2.0,"Hario V60 Paper Coffee Filters, Size 02, Natural, Tabbed",4.6,18269.0,712.0,Coffee filters
Disposable Coffee Filters,B0029PVRXI,4.0,"HARIO V60 Paper Coffee Filters, Size 01, 100 Count, Natural, Multicolor (V60 Filters)",4.4,2419.0,420.0,Coffee filters
Coffee Filters,B0029PVRXI,4.0,"HARIO V60 Paper Coffee Filters, Size 01, 100 Count, Natural, Multicolor (V60 Filters)",4.4,2419.0,440.0,Coffee filters
Coffee Maker Accessories,B001O0R46I,9.0,"Hario V60 Paper Coffee Filters, Size 02, Natural, Tabbed",4.6,18269.0,712.0,Coffee filters
Coffee Maker Accessories,B0029PVRXI,23.0,"HARIO V60 Paper Coffee Filters, Size 01, 100 Count, Natural, Multicolor (V60 Filters)",4.4,2419.0,440.0,Coffee filters
Disposable Coffee Filters,B0012VVB8Q,27.0,"Hario Coffee Paper Filters (Size 03, 40 Sheets, White)",4.5,1760.0,279.0,Coffee filters
"Coffee, Tea & Espresso",B09QHQNLFB,9.0,PANCA South Indian Filter Coffee Maker 200 ML 2-4 Cup Mug Madras Kaapi Kappi Drip Decoction Maker Brewer Dripper Stainless Steel Medium Size for Home & Kitchen,4.2,787.0,275.0,Coffee maker
Capsule Drawers,B07Z3Y8VJB,9.0,"EVERIE Tempered Glass Top Holder Drawer Compatible with Nespresso Capsules Coffee Pods, Holds 54 Pods",4.7,1347.0,8747.0,Coffee pod holder
Capsule Stands,B07K4ZMM1X,29.0,"K -32 Cup Carousel,Coffee Pod Holder Carousel Holds 32 Single Cup Coffee Pods in Matte Black",4.9,2106.0,8034.06,Coffee pod holder carousel
Capsule Drawers,B07D7M93ZW,7.0,EVERIE Coffee Pod Holder Drawer Compatible with Keurig K Cup Pods (Holds 18 Pods),4.7,2333.0,3082.0,Coffee pod holder drawer
Coffee Capsule Holders,B07D7M93ZW,15.0,EVERIE Coffee Pod Holder Drawer Compatible with Keurig K Cup Pods (Holds 18 Pods),4.7,2333.0,3082.0,Coffee pod holder drawer
Coffee Capsule Holders,B07Z3Y8VJB,26.0,"EVERIE Tempered Glass Top Holder Drawer Compatible with Nespresso Capsules Coffee Pods, Holds 54 Pods",4.7,1347.0,8747.0,Coffee pod holder drawer
Capsule Drawers,B0B1H7CBFV,22.0,Flagship for Vertuo Pod Holder Coffee Pod Organizer for Nespresso Pod Storage Glass Top(50 Pods Capacity),4.7,213.0,11688.0,Coffee pod organizer
Capsule Drawers,B00JZCBN4G,16.0,"Mind Reader 'Hero' 36 Capacity Single Serve Coffee Pod Storage Drawer, Silver/ Grey",4.4,1855.0,5100.0,Coffee pod storage drawer
Capsule Drawers,B07BC8DKN1,27.0,"Keurig Under Brewer Storage Drawer, K-Cup Pod Organizer Holds 35 Coffee Pods, Fits Under Keurig K-Cup Pod Coffee Makers, Black",4.7,11588.0,9600.0,Coffee pod storage drawer
Capsule Drawers,B07S1QLVXY,29.0,"Nifty Home Products 24 Coffee Pod Capacity Storage Drawer Rolling K-Cup Holder, 12.75x8.25x3, Black",4.7,3479.0,5914.62,Coffee pod storage drawer
Capsule Drawers,B078Z43GF2,28.0,"Mind Reader 72 Capacity Double K-Cup Coffee Pod Storage Organizer Drawer Metal Mesh, Black",4.2,1889.0,10393.0,Coffee pod storage organizer drawer
Disposable Coffee Filters,B075M22WK3,28.0,Toddy® Cold Brew System Home - Paper Filter Bags,4.9,1885.0,2299.0,Cold Brew System
Espresso Machines,B06ZY7R238,3.0,"Nespresso Essenza Mini Espresso Machine by De'Longhi, Red",4.6,1818.0,14340.0,Compact Espresso Machine
Espresso Machines,B06ZYSM2GR,16.0,"Nespresso Essenza Mini espresso Machine by De'Longhi, Black",4.5,3400.0,17299.0,Compact Espresso Machine
Pots & Pans,B00IYJEI4S,21.0,"Hawkins Futura 28 cm Tava, Hard Anodised Tawa with Stainless Steel Handle, Black (AT28)",4.3,12369.0,1090.0,Cooking Pan
Cookware,B00IYJEI4S,21.0,"Hawkins Futura 28 cm Tava, Hard Anodised Tawa with Stainless Steel Handle, Black (AT28)",4.3,12369.0,1090.0,Cooking Pan
Pots & Pans,B0B5XRDRFH,12.0,"Milton Pro Cook Kitchen Jewel Plus Set of 5 (Fry pan 24 cm/1.6 litres; Kadhai 24 cm/2.5 litres with Glass lid; Tawa 25 cm), Peach | Induction | Dishwasher | Hot Plate | Flame Safe",4.1,2144.0,1699.0,Cookware Set
Home & Kitchen,B0BLK9X25W,21.0,ALOXE Cosmetic Organizer Box Drawers Storage Plastic Stationary Box | Make Up Organiser For Women,4.1,2155.0,329.0,Cosmetic Organizer Box
Stir-Fry Pans,B09M417GLS,24.0,"OLRADA Iron Kadhai Deep Bottom Kadai, Frying Kadhai with Golden Rings, Black 8inch",3.8,376.0,349.0,Deep Bottom Kadhai
Frying Pans,B00EVQZEO6,16.0,"Hawkins Futura 1.5 Litre Deep Fry Pan, Hard Anodised Kadai, Round Bottom Kadhai, Small Kadai, Black (AK15)",4.4,4850.0,971.0,Deep Fry Pan
Frying Pans,B00EVQXLKU,27.0,"Hawkins Futura 2.5 Litre Deep Fry Pan, Hard Anodised Kadai with Stainless Steel Lid, Flat Bottom Kadhai, Black (AD25S)",4.4,4894.0,1818.0,Deep Fry Pan with Lid
Stir-Fry Pans,B07P6R6JYP,9.0,"Amazon Brand - Solimo Heavy gauge, Non-toxic, Hard Anodized Deep Kadhai (Black, 1 L, Aluminium, 18 cm)",4.2,982.0,549.0,Deep Kadhai
Kadhai & Woks,B07P6R6JYP,18.0,"Amazon Brand - Solimo Heavy gauge, Non-toxic, Hard Anodized Deep Kadhai (Black, 1 L, Aluminium, 18 cm)",4.2,982.0,549.0,Deep Kadhai
Stir-Fry Pans,B09BLFWT53,12.0,"Hawkins Futura 5 Litre Deep Kadhai, Non Stick Kadai with Glass Lid, Flat Bottom Induction Kadhai, Black (INK50G)",4.5,1439.0,2542.0,Deep Non Stick Kadhai with Glass Lid
Kadhai & Woks,B09BLFWT53,21.0,"Hawkins Futura 5 Litre Deep Kadhai, Non Stick Kadai with Glass Lid, Flat Bottom Induction Kadhai, Black (INK50G)",4.5,1439.0,2542.0,Deep Non-Stick Kadhai with Lid
Kadhai & Woks,B08SQ3454H,14.0,"Hawkins 4 Litre Deep Kadhai, Triply Stainless Steel Kadai with Glass Lid, Flat Bottom Induction Kadhai, Big Kadai, Silver (SSK40G)",4.5,1276.0,2579.0,Deep Stainless Steel Kadhai
Stir-Fry Pans,B08SQ3454H,8.0,"Hawkins 4 Litre Deep Kadhai, Triply Stainless Steel Kadai with Glass Lid, Flat Bottom Induction Kadhai, Big Kadai, Silver (SSK40G)",4.5,1276.0,2579.0,Deep Stainless Steel Kadhai with Glass Lid
Electric Kettles,B07Y2YQFG8,26.0,V-Guard VKS17-DG Digital Electric Kettle 1.7 Litre with Digital Controls & Variable Temperature Settings | Multicolor LED indicators | Hot water kettle for Fast Boiling water,4.4,1625.0,2099.0,Digital Electric Kettle
Kettles & Tea Machines,B07Y2YQFG8,26.0,V-Guard VKS17-DG Digital Electric Kettle 1.7 Litre with Digital Controls & Variable Temperature Settings | Multicolor LED indicators | Hot water kettle for Fast Boiling water,4.4,1625.0,2099.0,Digital Electric Kettle with Variable Temperature Settings
Disposable Coffee Filters,B076MCYZ9R,14.0,"CAFEC Abaca Cone-Shaped Coffee Paper Filter, Size 4, White, Pack of 100 | Use for V60, Flower Dripper, Pour Over | 100% Environmentally Friendly | Disposable Paper Coffee Filters (AC4-100W)",4.6,1086.0,649.0,Disposable Coffee Paper Filters
Coffee Filters,B076MCYZ9R,18.0,"CAFEC Abaca Cone-Shaped Coffee Paper Filter, Size 4, White, Pack of 100 | Use for V60, Flower Dripper, Pour Over | 100% Environmentally Friendly | Disposable Paper Coffee Filters (AC4-100W)",4.6,1086.0,649.0,Disposable Coffee Paper Filters
Tea Filters,B09W2571WC,7.0,100 Pcs Sichumaria Transparent White Disposable Tea Filter Bags Empty Dip Tea Bags Filter Tea Bags Cups for Loose Leaf Teal (5.5x7cm),4.4,114.0,258.0,Disposable Tea Filter Bags
Coffee Maker Accessories,B09W2571WC,13.0,100 Pcs Sichumaria Transparent White Disposable Tea Filter Bags Empty Dip Tea Bags Filter Tea Bags Cups for Loose Leaf Teal (5.5x7cm),4.4,114.0,258.0,Disposable Tea Filter Bags
Tea Filters,B07CZXCTHB,15.0,"HASTHIP® 100 Pcs Disposable Tea Filter Bags, New Non-Woven Fabrics Empty Tea Bag with String Heal Filter Paper for Tea Leaf",4.1,337.0,258.0,Disposable Tea Filter Bags
Coffee Maker Accessories,B07CZXCTHB,29.0,"HASTHIP® 100 Pcs Disposable Tea Filter Bags, New Non-Woven Fabrics Empty Tea Bag with String Heal Filter Paper for Tea Leaf",4.1,337.0,299.0,Disposable Tea Filter Bags
